{
  "$schema": "https://json-schema.org/draft/2020-12/schema",
  "$id": "alias-theme.schema.json",
  "title": "Alias word theme",
  "type": "object",
  "additionalProperties": false,
  "required": ["schemaVersion", "id", "name", "description", "words"],
  "properties": {
    "schemaVersion": { "const": 1 },
    "id": {
      "type": "string",
      "pattern": "^[a-z0-9]+(?:-[a-z0-9]+)*$",
      "maxLength": 64
    },
    "name": { "type": "string", "minLength": 1, "maxLength": 80 },
    "description": { "type": "string", "maxLength": 200 },
    "words": {
      "type": "array",
      "minItems": 10,
      "maxItems": 300,
      "uniqueItems": true,
      "items": { "type": "string", "minLength": 1, "maxLength": 80 }
    }
  }
}
