{
  "schemaVersion": 1,
  "id": "disney",
  "name": "Disney",
  "description": "Герои, миры и знакомые истории",
  "words": [
    "Микки Маус", "Минни Маус", "Дональд Дак", "Гуфи", "Золушка",
    "Белоснежка", "Ариэль", "Жасмин", "Рапунцель", "Мулан",
    "Моана", "Эльза", "Олаф", "Симба", "Тимон",
    "Пумба", "Стич", "Винни-Пух", "Тигра", "Пиноккио",
    "Бэмби", "Дамбо", "Круэлла", "Джинн", "Капитан Крюк",
    "Хрустальная туфелька", "Волшебная палочка", "Замок", "Русалка", "Король Лев"
  ]
}
