{
  "schemaVersion": 1,
  "id": "berries",
  "name": "Ягоды и фрукты",
  "description": "Привычные и экзотические плоды",
  "words": [
    "Яблоко", "Груша", "Банан", "Апельсин", "Мандарин",
    "Лимон", "Персик", "Абрикос", "Слива", "Вишня",
    "Черешня", "Клубника", "Малина", "Ежевика", "Черника",
    "Смородина", "Крыжовник", "Арбуз", "Дыня", "Виноград",
    "Ананас", "Манго", "Киви", "Гранат", "Кокос",
    "Авокадо", "Хурма", "Инжир", "Грейпфрут", "Маракуйя"
  ]
}
