{
  "schemaVersion": 1,
  "id": "minecraft",
  "name": "Minecraft",
  "description": "Мобы, биомы, предметы и сооружения",
  "words": [
    "Зомби",
    "Скелет",
    "Крипер",
    "Паук",
    "Ведьма",
    "Грибная корова",
    "Свинья",
    "Овца",
    "Курица",
    "Лавамерка",
    "Гаст",
    "Пиглин",
    "Ифрит",
    "Эндермен",
    "Шалкер",
    "Пустыня",
    "Джунгли",
    "Болото",
    "Вишнёвая роща",
    "Алмазная кирка",
    "Деревянный топор",
    "Золотая лопата",
    "Удочка с искаженным грибом",
    "Ножницы",
    "Незеритовый меч",
    "Лук",
    "Арбалет",
    "Щит",
    "Трезубец",
    "Алмаз",
    "Изумруд",
    "Железный слиток",
    "Редстоун",
    "Динамит",
    "Поршень",
    "Повторитель",
    "Вагонетка",
    "Сундук-ловушка",
    "Аванпост разбойников",
    "Заброшенная шахта",
    "Пустынный колодец",
    "Адский бастион",
    "Лесной особняк",
    "Хижина ведьмы"
  ]
}
