{
  "schemaVersion": 1,
  "id": "phone-apps",
  "name": "Приложения на телефоне",
  "description": "Популярные соцсети, сервисы, программы и мобильные игры",
  "words": [
    "TikTok",
    "Instagram",
    "ВКонтакте",
    "Одноклассники",
    "Snapchat",
    "Pinterest",
    "Likee",
    "Дзен",
    "Threads",
    "X (Twitter)",
    "Facebook",
    "Reddit",
    "Telegram",
    "MAX",
    "WhatsApp",
    "VK Мессенджер",
    "Discord",
    "Viber",
    "Zoom",
    "Google Meet",
    "FaceTime",
    "Microsoft Teams",
    "Wildberries",
    "Ozon",
    "Авито",
    "Яндекс Маркет",
    "AliExpress",
    "Lamoda",
    "Мегамаркет",
    "ВкусВилл",
    "Яндекс Лавка",
    "Самокат",
    "Купер",
    "Магнит",
    "Пятёрочка",
    "Детский мир",
    "YouTube",
    "VK Видео",
    "RuTube",
    "Кинопоиск",
    "Иви",
    "Okko",
    "Wink",
    "KION",
    "PREMIER",
    "START",
    "Яндекс Музыка",
    "VK Музыка",
    "Spotify",
    "Apple Music",
    "Shazam",
    "Погода",
    "Календарь",
    "Заметки",
    "Камера",
    "Фото",
    "Почта",
    "App Store",
    "Карты",
    "Настройки",
    "Калькулятор",
    "Контакты",
    "Часы",
    "Файлы",
    "VPN",
    "RuStore",
    "Яндекс Go",
    "Яндекс Карты",
    "2ГИС",
    "Google Maps",
    "Ситимобил",
    "Яндекс Драйв",
    "Whoosh",
    "РЖД Пассажирам",
    "Авиасейлс",
    "Туту",
    "Аэрофлот",
    "S7 Airlines",
    "Госуслуги",
    "СберБанк Онлайн",
    "Т-Банк",
    "Альфа-Банк",
    "ВТБ Онлайн",
    "Газпромбанк",
    "МТС Банк",
    "Почта Банк",
    "Совкомбанк",
    "Россельхозбанк",
    "СБПэй",
    "Mir Pay",
    "Яндекс Пэй",
    "Госключ",
    "Налоги ФЛ",
    "МТС",
    "МегаФон",
    "билайн",
    "t2",
    "Yota",
    "Google",
    "Яндекс",
    "Google Chrome",
    "Safari",
    "Яндекс Браузер",
    "Firefox",
    "Яндекс Диск",
    "Google Диск",
    "Облако Mail",
    "Kaspersky",
    "Gmail",
    "Яндекс Почта",
    "Microsoft Word",
    "Microsoft Excel",
    "Microsoft PowerPoint",
    "Google Документы",
    "Google Таблицы",
    "Notion",
    "Duolingo",
    "ChatGPT",
    "DeepSeek",
    "GigaChat",
    "Яндекс Переводчик",
    "Google Переводчик",
    "Adobe Acrobat",
    "Brawl Stars",
    "Roblox",
    "Minecraft",
    "PUBG Mobile",
    "Standoff 2",
    "Tanks Blitz",
    "Genshin Impact",
    "Mobile Legends",
    "Call of Duty Mobile",
    "Clash Royale",
    "Subway Surfers",
    "Gardenscapes",
    "Toca Boca World"
  ]
}
