{
  "schemaVersion": 1,
  "id": "places",
  "name": "Места",
  "description": "Знакомые места и учреждения",
  "words": [
    "Аэропорт",
    "Железнодорожный вокзал",
    "Порт",
    "Метро",
    "Автобусная остановка",
    "Школа",
    "Университет",
    "Университет Синергия (лол)",
    "Больница",
    "Стоматология",
    "Ветеринарная клиника",
    "Ресторан",
    "Столовая",
    "Бар",
    "Кофейня Джеффрис (в вышке)",
    "Супермаркет",
    "Рынок",
    "Торговый центр",
    "Театр",
    "Музей",
    "Цирк",
    "Стадион",
    "Спортзал",
    "Бассейн",
    "Каток",
    "Теннисный корт",
    "Отель",
    "Санаторий",
    "Офис",
    "Завод",
    "Стройка",
    "Банк",
    "МФЦ",
    "Парк",
    "Пляж",
    "Зоопарк",
    "Парк аттракционов"
  ]
}
