{
  "schemaVersion": 1,
  "id": "physics",
  "name": "Физика",
  "description": "Квантовые эффекты, космос, парадоксы и теоретическая физика",
  "words": [
    "Кот Шрёдингера",
    "Теория относительности",
    "Квантовая запутанность",
    "Туннельный эффект",
    "Фотоэффект",
    "Бозон Хиггса",
    "Кварк",
    "Антиматерия",
    "Энергия",
    "Чёрная дыра",
    "Горизонт событий",
    "Сингулярность",
    "Кротовая нора",
    "Пространство-время",
    "Гравитационная волна",
    "Большой взрыв",
    "Сверхновая",
    "Красное смещение",
    "Невесомость",
    "Абсолютный ноль",
    "Энтропия",
    "Вечный двигатель",
    "Сверхпроводимость",
    "Полупроводник",
    "Плазма",
    "Ядерный синтез",
    "Цепная реакция",
    "Критическая масса",
    "Коллайдер",
    "Резонанс",
    "Интерференция",
    "Дифракция",
    "Поляризация",
    "Хаотическое движение",
    "Вращение Земли",
    "Закон Ома",
    "Закон сохранения энергии",
    "Спин частицы",
    "Радиоактивный распад",
    "Синее свечение реактора",
    "Сферический конь в вакууме"
  ]
}
