{
  "schemaVersion": 1,
  "id": "phone-apps",
  "name": "Приложения",
  "description": "Знакомые сервисы и функции смартфона",
  "words": [
    "Telegram", "WhatsApp", "YouTube", "TikTok", "VK",
    "Яндекс Карты", "Яндекс Go", "Госуслуги", "СберБанк", "Авито",
    "Ozon", "Wildberries", "Spotify", "Apple Music", "Кинопоиск",
    "Калькулятор", "Будильник", "Камера", "Галерея", "Календарь",
    "Погода", "Заметки", "Переводчик", "Почта", "Браузер",
    "Контакты", "Навигатор", "Доставка еды", "Видеозвонок", "Облачное хранилище"
  ]
}
