{
  "schemaVersion": 1,
  "id": "berries",
  "name": "Ягоды и фрукты",
  "description": "Привычные и экзотические фрукты, вкусные и ядовитые ягоды",
  "words": [
    "Яблоко",
    "Банан",
    "Груша",
    "Апельсин",
    "Персик",
    "Ландыш",
    "Волчья ягода",
    "Вороний глаз",
    "Белладонна",
    "Дурман",
    "Клубника",
    "Малина",
    "Ежевика",
    "Черника",
    "Черешня",
    "Смородина",
    "Клюква",
    "Брусника",
    "Морошка",
    "Облепиха",
    "Драгонфрут",
    "Старфрут",
    "Манго",
    "Маракуйя",
    "Личи",
    "Виноград",
    "Дыня",
    "Арбуз",
    "Гранат",
    "Киви"
  ]
}
