{
  "schemaVersion": 1,
  "id": "chip-flavors",
  "name": "Вкусы чипсов",
  "description": "Разные по смыслу вкусы — от знакомой классики до безумных экспериментов",
  "words": [
    "С солью",
    "Сметана и лук",
    "Паприка",
    "Аджика",
    "Малосольный огурец с укропом",
    "Соль и уксус",
    "Картошечка с маслом и укропом",
    "Медовая горчица",
    "Ранч",
    "Чеснок",
    "Кетчуп",
    "Сыр чеддер с халапеньо по-мексикански",
    "Нежный сыр с трюфелем",
    "Пицца «Четыре сыра»",
    "Белые грибы со сметаной",
    "Драники",
    "Том ям",
    "Бешбармак",
    "Тако",
    "Терияки",
    "Карри масала",
    "Гуакамоле",
    "Курица и вафли",
    "Двойной гамбургер",
    "Стейк рибай",
    "Куриные крылышки барбекю",
    "Копчёный бекон",
    "Шашлык",
    "Утка по-пекински",
    "Ростбиф с горчицей",
    "Пепперони",
    "Хот-дог с горчицей",
    "Устрица с жареным чесноком",
    "Острый кальмар",
    "Пряная креветка",
    "Лангустины в томатном соусе",
    "Краб",
    "Чёрная икра",
    "Лосось в сливочном соусе",
    "Морские водоросли нори",
    "Такояки с осьминогом",
    "Гребешки в сливочном масле",
    "Чили и лайм",
    "Шрирача",
    "Васаби",
    "Кимчи",
    "Сычуаньский хот-пот мала",
    "Сальса верде",
    "Пери-пери",
    "Лечо",
    "Томат с базиликом",
    "Розмарин с морской солью",
    "Капучино",
    "Лось в кленовом сиропе",
    "Булочка с корицей",
    "Черника",
    "Цветущая сакура",
    "Игристое",
    "Солёная карамель",
    "Шоколад",
    "Мёд и сливочное масло",
    "Банан",
    "Клубника со сливками",
    "Тыквенные пряности",
    "Кокосовое молоко",
    "Маршмеллоу",
    "Кола"
  ]
}
