{
  "schemaVersion": 1,
  "id": "drinks",
  "name": "Напитки",
  "description": "Безалкогольные и алкогольные напитки",
  "words": [
    "Вода", "Чай", "Кофе", "Какао", "Молоко",
    "Кефир", "Лимонад", "Кола", "Квас", "Морс",
    "Компот", "Сок", "Смузи", "Милкшейк", "Энергетик",
    "Эспрессо", "Капучино", "Латте", "Горячий шоколад", "Минеральная вода",
    "Пиво", "Вино", "Шампанское", "Сидр", "Виски",
    "Коньяк", "Ром", "Текила", "Мартини", "Глинтвейн"
  ]
}
