{
  "schemaVersion": 1,
  "id": "cinema",
  "name": "Кино",
  "description": "Фильмы, профессии, жанры и всё вокруг экрана",
  "words": [
    "Режиссёр", "Актёр", "Сценарий", "Кинокамера", "Оскар",
    "Попкорн", "Премьера", "Трейлер", "Субтитры", "Дубляж",
    "Комедия", "Ужасы", "Боевик", "Мелодрама", "Фантастика",
    "Документальный фильм", "Каскадёр", "Злодей", "Супергерой", "Саундтрек",
    "Спойлер", "Титры", "Кинотеатр", "Мультфильм", "Сериал",
    "Зелёный экран", "Съёмочная площадка", "Главная роль", "Киномонстр", "Продолжение"
  ]
}
