{
  "schemaVersion": 1,
  "id": "countries",
  "name": "Страны",
  "description": "Самые известные страны мира",
  "words": [
    "США",
    "Канада",
    "Мексика",
    "Бразилия",
    "Аргентина",
    "Чили",
    "Колумбия",
    "Перу",
    "Франция",
    "Германия",
    "Великобритания",
    "Нидерланды",
    "Бельгия",
    "Испания",
    "Португалия",
    "Италия",
    "Греция",
    "Хорватия",
    "Норвегия",
    "Швеция",
    "Финляндия",
    "Дания",
    "Исландия",
    "Польша",
    "Чехия",
    "Австрия",
    "Венгрия",
    "Румыния",
    "Россия",
    "Украина",
    "Беларусь",
    "Грузия",
    "Армения",
    "Турция",
    "Израиль",
    "ОАЭ",
    "Саудовская Аравия",
    "Иран",
    "Китай",
    "Япония",
    "Южная Корея",
    "Северная Корея",
    "Индия",
    "Таиланд",
    "Вьетнам",
    "Индонезия",
    "Египет",
    "Марокко",
    "Австралия",
    "Новая Зеландия"
  ]
}
