{
  "schemaVersion": 1,
  "id": "politicians",
  "name": "Политики",
  "description": "Известные мировые лидеры и политические деятели",
  "words": [
    "Пётр I",
    "Екатерина II",
    "Александр II",
    "Николай II",
    "Владимир Ленин",
    "Иосиф Сталин",
    "Никита Хрущёв",
    "Леонид Брежнев",
    "Михаил Горбачёв",
    "Борис Ельцин",
    "Владимир Путин",
    "Дмитрий Медведев",
    "Александр Лукашенко",
    "Владимир Зеленский",
    "Пётр Порошенко",
    "Виктор Янукович",
    "Дональд Трамп",
    "Джо Байден",
    "Барак Обама",
    "Билл Клинтон",
    "Джордж Вашингтон",
    "Авраам Линкольн",
    "Франклин Рузвельт",
    "Джон Кеннеди",
    "Уинстон Черчилль",
    "Маргарет Тэтчер",
    "Борис Джонсон",
    "Наполеон Бонапарт",
    "Шарль де Голль",
    "Эмманюэль Макрон",
    "Отто фон Бисмарк",
    "Адольф Гитлер",
    "Ангела Меркель",
    "Бенито Муссолини",
    "Реджеп Эрдоган",
    "Биньямин Нетаньяху",
    "Саддам Хусейн",
    "Муаммар Каддафи",
    "Мао Цзэдун",
    "Си Цзиньпин",
    "Ким Чен Ын",
    "Фидель Кастро",
    "Че Гевара",
    "Махатма Ганди",
    "Нельсон Мандела"
  ]
}
