{
  "schemaVersion": 1,
  "id": "mathematics",
  "name": "Математика",
  "description": "Числа, фигуры, действия и школьные термины",
  "words": [
    "Число", "Ноль", "Дробь", "Процент", "Уравнение",
    "Переменная", "Формула", "График", "Функция", "Корень",
    "Степень", "Логарифм", "Интеграл", "Производная", "Бесконечность",
    "Треугольник", "Квадрат", "Окружность", "Радиус", "Диаметр",
    "Угол", "Площадь", "Объём", "Теорема", "Доказательство",
    "Калькулятор", "Простое число", "Среднее значение", "Вероятность", "Координата"
  ]
}
