{
  "schemaVersion": 1,
  "id": "drugs",
  "name": "Наркотики",
  "description": "Мы не пропагандируем наркотики и не даём инструкций. Незаконное потребление опасно, а незаконный оборот запрещён законом",
  "words": [
    "Марихуана",
    "Гашиш",
    "Спайс",
    "Кокаин",
    "Крэк",
    "Метамфетамин",
    "Мефедрон",
    "Героин",
    "Опиум",
    "Морфин",
    "Кодеин",
    "Метадон",
    "Фентанил",
    "ЛСД",
    "ДМТ",
    "Экстази",
    "Кетамин",
    "Веселящий газ",
    "Феназепам",
    "Ксанакс",
    "Снотворное",
    "Транквилизаторы",
    "Клофелин",
    "Корвалол",
    "Клей",
    "Бензин",
    "Растворитель",
    "Газ для зажигалок",
    "Мухомор"
  ]
}
